{
  "bank_id": "rbc_public_questions_v0_1",
  "lens_id": "rbc_public_v0_1",
  "version": "0.1.0-draft",
  "source_cutoff": "2026-05-09",
  "questions": [
    {
      "question_id": "RBC-Q-001",
      "question_type": "behavioral",
      "role_families": [
        "all"
      ],
      "aims_dimensions": [
        "impact_results",
        "collaboration_communication",
        "ownership_execution"
      ],
      "question_summary": "Original generated question from official and distilled company-lens patterns.",
      "generated_question": "Tell me about a time you helped a client, colleague, or community stakeholder achieve a better outcome while protecting trust and good judgment.",
      "follow_up_strategy": [
        "Ask for the candidate's exact role and action.",
        "Probe client/customer, risk, conduct, and business impact.",
        "Ask what evidence or metric shows the outcome mattered.",
        "Check whether the answer is role-specific rather than generic."
      ],
      "difficulty": "intermediate",
      "evidence_ids": [
        "RBC-OFFICIAL-001",
        "RBC-VALUES-001"
      ],
      "copyright_note": "Original generated question from summarized patterns; no copied private source question."
    },
    {
      "question_id": "RBC-Q-002",
      "question_type": "situational",
      "role_families": [
        "retail_banking",
        "wealth",
        "personal_banking"
      ],
      "aims_dimensions": [
        "collaboration_communication",
        "impact_results",
        "analytical_problem_solving"
      ],
      "question_summary": "Original generated question from official and distilled company-lens patterns.",
      "generated_question": "A client asks for a product that may not fit their goals or risk tolerance. How would you handle the conversation?",
      "follow_up_strategy": [
        "Ask for the candidate's exact role and action.",
        "Probe client/customer, risk, conduct, and business impact.",
        "Ask what evidence or metric shows the outcome mattered.",
        "Check whether the answer is role-specific rather than generic."
      ],
      "difficulty": "intermediate",
      "evidence_ids": [
        "RBC-VALUES-001",
        "RBC-RISK-001"
      ],
      "copyright_note": "Original generated question from summarized patterns; no copied private source question."
    },
    {
      "question_id": "RBC-Q-003",
      "question_type": "case",
      "role_families": [
        "risk",
        "operations",
        "technology",
        "corporate"
      ],
      "aims_dimensions": [
        "analytical_problem_solving",
        "ownership_execution",
        "structured_thinking"
      ],
      "question_summary": "Original generated question from official and distilled company-lens patterns.",
      "generated_question": "You find a process issue that improves speed but weakens control quality. How would you assess, escalate, and improve it?",
      "follow_up_strategy": [
        "Ask for the candidate's exact role and action.",
        "Probe client/customer, risk, conduct, and business impact.",
        "Ask what evidence or metric shows the outcome mattered.",
        "Check whether the answer is role-specific rather than generic."
      ],
      "difficulty": "advanced",
      "evidence_ids": [
        "RBC-CODE-001",
        "RBC-RISK-001"
      ],
      "copyright_note": "Original generated question from summarized patterns; no copied private source question."
    },
    {
      "question_id": "RBC-Q-004",
      "question_type": "motivation",
      "role_families": [
        "all"
      ],
      "aims_dimensions": [
        "impact_results",
        "growth_mindset",
        "structured_thinking"
      ],
      "question_summary": "Original generated question from official and distilled company-lens patterns.",
      "generated_question": "Why is RBC the right environment for the client or community impact you want to create, and what evidence shows you can contribute?",
      "follow_up_strategy": [
        "Ask for the candidate's exact role and action.",
        "Probe client/customer, risk, conduct, and business impact.",
        "Ask what evidence or metric shows the outcome mattered.",
        "Check whether the answer is role-specific rather than generic."
      ],
      "difficulty": "intermediate",
      "evidence_ids": [
        "RBC-OFFICIAL-001",
        "RBC-HIRE-001"
      ],
      "copyright_note": "Original generated question from summarized patterns; no copied private source question."
    },
    {
      "question_id": "RBC-Q-005",
      "question_type": "behavioral",
      "role_families": [
        "banking_operations",
        "wealth",
        "retail_banking"
      ],
      "aims_dimensions": [
        "impact_results",
        "ownership_execution",
        "collaboration_communication"
      ],
      "question_summary": "Original JD-grounded question from RBC careers aggregate: client service, documentation, account administration, and trusted advice.",
      "generated_question": "Tell me about a time you supported a client or advisor team where accuracy, documentation, and timely follow-through all mattered. What did you do and what changed for the client or team?",
      "follow_up_strategy": [
        "Ask for the exact account, process, or service issue.",
        "Probe how the candidate managed timelines and documentation.",
        "Ask how they communicated with clients, advisors, or internal partners.",
        "Check whether the outcome protected trust and service quality."
      ],
      "difficulty": "intermediate",
      "evidence_ids": [
        "RBC-JD-001",
        "RBC-JD-003"
      ],
      "copyright_note": "Original generated question from aggregate manually entered RBC careers postings; no copied JD text."
    },
    {
      "question_id": "RBC-Q-006",
      "question_type": "case",
      "role_families": [
        "risk_compliance",
        "audit",
        "finance",
        "operations"
      ],
      "aims_dimensions": [
        "analytical_problem_solving",
        "structured_thinking",
        "ownership_execution"
      ],
      "question_summary": "Original JD-grounded question from RBC careers aggregate: controls, audit, risk management, and escalation.",
      "generated_question": "You discover a recurring process issue that creates faster turnaround but weakens control evidence. How would you assess materiality, engage stakeholders, and drive a practical fix?",
      "follow_up_strategy": [
        "Ask what evidence they would collect first.",
        "Probe risk severity, control design, and escalation threshold.",
        "Ask how they would keep the business moving while improving control quality.",
        "Require a clear implementation and monitoring plan."
      ],
      "difficulty": "advanced",
      "evidence_ids": [
        "RBC-JD-002",
        "RBC-JD-004",
        "RBC-RISK-001"
      ],
      "copyright_note": "Original generated case from aggregate manually entered RBC careers postings; no copied JD text."
    },
    {
      "question_id": "RBC-Q-007",
      "question_type": "situational",
      "role_families": [
        "operations",
        "project_management",
        "data_analytics",
        "technology"
      ],
      "aims_dimensions": [
        "structured_thinking",
        "ownership_execution",
        "collaboration_communication"
      ],
      "question_summary": "Original JD-grounded question from RBC careers aggregate: process ownership, stakeholder coordination, and execution discipline.",
      "generated_question": "A cross-functional process change is behind schedule because business, operations, and control stakeholders disagree on priorities. How would you get alignment and keep execution moving?",
      "follow_up_strategy": [
        "Ask how the candidate frames the decision and constraints.",
        "Probe stakeholder mapping and communication cadence.",
        "Ask how risks and dependencies are tracked.",
        "Check whether they define a measurable next step."
      ],
      "difficulty": "advanced",
      "evidence_ids": [
        "RBC-JD-001",
        "RBC-JD-004"
      ],
      "copyright_note": "Original generated situational question from aggregate manually entered RBC careers postings; no copied JD text."
    },
    {
      "question_id": "RBC-Q-008",
      "question_type": "motivation",
      "role_families": [
        "all"
      ],
      "aims_dimensions": [
        "impact_results",
        "growth_mindset",
        "structured_thinking"
      ],
      "question_summary": "Original JD-grounded motivation question from RBC careers aggregate: role-specific RBC fit.",
      "generated_question": "Looking at this RBC role, which part of the job most directly matches your strengths, and what specific evidence shows you can deliver in that environment?",
      "follow_up_strategy": [
        "Ask the candidate to connect to one JD requirement, not the RBC brand in general.",
        "Probe one concrete past example.",
        "Check whether the example shows client service, collaboration, control discipline, or execution.",
        "Ask what they would need to learn quickly in the role."
      ],
      "difficulty": "beginner",
      "evidence_ids": [
        "RBC-JD-001",
        "RBC-HIRE-001"
      ],
      "copyright_note": "Original generated motivation question from aggregate manually entered RBC careers postings; no copied JD text."
    }
  ]
}
