{
  "bank_id": "microsoft_public_questions_v0_1",
  "lens_id": "microsoft_public_v0_1",
  "version": "0.1.0-draft",
  "source_cutoff": "2026-05-04",
  "questions": [
    {
      "question_id": "MSFT-Q-001",
      "question_type": "behavioral",
      "role_families": ["all"],
      "aims_dimensions": ["growth_mindset", "ownership_execution", "collaboration_communication"],
      "question_summary": "Microsoft culture emphasizes growth mindset and learning from feedback.",
      "generated_question": "Tell me about a time feedback showed that your first approach was not good enough. How did you respond, what did you change, and what improved afterward?",
      "follow_up_strategy": ["Ask what feedback was hard to hear.", "Probe the behavior or mechanism that changed.", "Ask what measurable improvement followed.", "Check whether the candidate shows learning rather than defensiveness."],
      "difficulty": "intermediate",
      "evidence_ids": ["MSFT-CULTURE-001", "MSFT-PRIV-001"],
      "copyright_note": "Original generated question from Microsoft culture and distilled patterns."
    },
    {
      "question_id": "MSFT-Q-002",
      "question_type": "technical",
      "role_families": ["software_engineering", "sde"],
      "aims_dimensions": ["analytical_problem_solving", "structured_thinking", "collaboration_communication"],
      "question_summary": "Microsoft technical guidance emphasizes clarify, analyze, investigate, build/design, and test.",
      "generated_question": "You inherit a service where a recent change caused intermittent failures that are hard to reproduce. Walk me through how you would clarify the problem, investigate the data, fix it, and test confidence.",
      "follow_up_strategy": ["Ask what signals and logs the candidate checks first.", "Probe hypothesis generation and elimination.", "Ask how code and system design are validated.", "Check whether testing includes regression and monitoring."],
      "difficulty": "advanced",
      "evidence_ids": ["MSFT-HIRE-002", "MSFT-PRIV-002"],
      "copyright_note": "Original generated technical prompt."
    },
    {
      "question_id": "MSFT-Q-003",
      "question_type": "case",
      "role_families": ["ai_ml", "product", "cloud", "software_engineering"],
      "aims_dimensions": ["analytical_problem_solving", "impact_results", "structured_thinking"],
      "question_summary": "Microsoft Responsible AI principles define fairness, reliability/safety, privacy/security, inclusiveness, transparency, and accountability as boundaries.",
      "generated_question": "A Copilot-like feature improves productivity for most users, but testing shows errors that could affect a regulated customer workflow. How would you decide whether and how to release it?",
      "follow_up_strategy": ["Ask how the candidate identifies affected users and failure severity.", "Probe fairness, reliability, privacy, security, transparency, and accountability controls.", "Ask what release guardrails and monitoring are required.", "Check whether customer empowerment includes trust."],
      "difficulty": "advanced",
      "evidence_ids": ["MSFT-AI-001", "MSFT-AI-002", "MSFT-RISK-002"],
      "copyright_note": "Original generated responsible AI case."
    },
    {
      "question_id": "MSFT-Q-004",
      "question_type": "role_knowledge",
      "role_families": ["cloud", "solutions_architecture"],
      "aims_dimensions": ["analytical_problem_solving", "impact_results", "collaboration_communication"],
      "question_summary": "Cloud/customer-facing roles should connect technical architecture to customer requirements, reliability, security, and adoption.",
      "generated_question": "A customer wants to migrate a critical workload to cloud quickly, but their security and reliability requirements are not fully defined. How would you guide the conversation and shape the solution?",
      "follow_up_strategy": ["Ask how requirements are discovered and prioritized.", "Probe risk, reliability, identity/security, and operational readiness.", "Ask how the candidate communicates trade-offs to technical and business stakeholders.", "Check whether the solution empowers customer success rather than just selling migration."],
      "difficulty": "advanced",
      "evidence_ids": ["MSFT-OFFICIAL-001", "MSFT-PRIV-003", "MSFT-PRIV-004"],
      "copyright_note": "Original generated cloud/customer prompt."
    },
    {
      "question_id": "MSFT-Q-005",
      "question_type": "role_knowledge",
      "role_families": ["data_engineering", "data_analytics"],
      "aims_dimensions": ["analytical_problem_solving", "structured_thinking", "impact_results"],
      "question_summary": "Microsoft data role private signals emphasize SQL/data engineering, data quality, communication, and business usefulness.",
      "generated_question": "A dashboard used by leadership shows a sudden revenue trend change, but source systems recently changed. How would you validate the data and communicate whether leaders should act on it?",
      "follow_up_strategy": ["Ask how definitions, pipelines, joins, and refresh timing are checked.", "Probe data quality and root-cause isolation.", "Ask how uncertainty is communicated.", "Check whether the answer links data trust to business decision quality."],
      "difficulty": "intermediate",
      "evidence_ids": ["MSFT-PRIV-003"],
      "copyright_note": "Original generated data prompt."
    },
    {
      "question_id": "MSFT-Q-006",
      "question_type": "motivation",
      "role_families": ["all"],
      "aims_dimensions": ["impact_results", "growth_mindset", "collaboration_communication"],
      "question_summary": "Microsoft fit should connect motivation to empowerment, learning, collaboration, and customer/organization impact.",
      "generated_question": "What customer, team, or technology problem makes Microsoft the right environment for you, and what evidence shows you can learn and contribute there?",
      "follow_up_strategy": ["Ask for a specific customer or organization impact.", "Probe learning from past feedback.", "Ask how the candidate collaborates across functions.", "Check whether motivation is more than brand or product familiarity."],
      "difficulty": "beginner",
      "evidence_ids": ["MSFT-OFFICIAL-001", "MSFT-CULTURE-001"],
      "copyright_note": "Original generated motivation question."
    }
  ]
}
